{
  "$schema": "http://json-schema.org/draft-07/schema#",
  "title": "Dev-Pipeline Feature List",
  "description": "Schema for .prizmkit/plans/feature-list.json",
  "type": "object",
  "required": [
    "$schema",
    "project_name",
    "features"
  ],
  "properties": {
    "$schema": {
      "type": "string",
      "const": "dev-pipeline-feature-list-v1"
    },
    "project_name": {
      "type": "string",
      "minLength": 1
    },
    "project_description": {
      "type": "string"
    },
    "created_at": {
      "type": "string",
      "format": "date-time"
    },
    "created_by": {
      "type": "string"
    },
    "features": {
      "type": "array",
      "minItems": 1,
      "items": {
        "type": "object",
        "required": [
          "id",
          "title",
          "description",
          "priority",
          "dependencies",
          "acceptance_criteria",
          "status"
        ],
        "properties": {
          "id": {
            "type": "string",
            "pattern": "^F-\\d{3}(-[A-Z])?$",
            "description": "Feature ID, format F-001, F-002... Optional sub-feature suffix: F-001-A"
          },
          "title": {
            "type": "string",
            "minLength": 1,
            "description": "Feature title — brief description of the functionality"
          },
          "description": {
            "type": "string",
            "minLength": 1,
            "description": "Detailed feature description: what it does, why it's needed"
          },
          "priority": {
            "type": "string",
            "enum": [
              "critical",
              "high",
              "medium",
              "low"
            ],
            "description": "Feature priority. Pipeline processes critical before high before medium before low; within same level, array order determines sequence."
          },
          "estimated_complexity": {
            "type": "string",
            "enum": [
              "low",
              "medium",
              "high",
              "critical"
            ],
            "description": "Estimated implementation complexity. Determines pipeline execution tier: low/medium → lite (single agent), high → standard (orchestrator + dev + reviewer), critical → full (full team + critic)."
          },
          "dependencies": {
            "type": "array",
            "items": {
              "type": "string",
              "pattern": "^F-\\d{3}(-[A-Z])?$"
            },
            "description": "IDs of features that must be completed before this one"
          },
          "acceptance_criteria": {
            "type": "array",
            "minItems": 1,
            "items": {
              "type": "string"
            },
            "description": "Conditions that must be met for the feature to be considered complete"
          },
          "status": {
            "type": "string",
            "enum": [
              "pending",
              "in_progress",
              "completed",
              "failed",
              "skipped",
              "split",
              "auto_skipped"
            ],
            "description": "Feature status. Pipeline manages status transitions automatically."
          },
          "session_granularity": {
            "type": "string",
            "enum": [
              "feature",
              "sub_feature",
              "auto"
            ],
            "default": "feature",
            "description": "Session execution strategy: feature=one-session-per-feature, sub_feature=one-session-per-sub-feature, auto=pipeline-decides"
          },
          "sub_features": {
            "type": "array",
            "items": {
              "type": "object",
              "required": [
                "id",
                "title",
                "description"
              ],
              "properties": {
                "id": {
                  "type": "string",
                  "pattern": "^F-\\d{3}-[A-Z]$"
                },
                "title": {
                  "type": "string",
                  "minLength": 1
                },
                "description": {
                  "type": "string",
                  "minLength": 1
                }
              }
            }
          },
          "model": {
            "type": "string",
            "description": "AI model ID for this feature. Overrides $MODEL env var."
          },
          "critic": {
            "type": "boolean",
            "description": "Enable adversarial plan challenge before implementation. Default: false.",
            "default": false
          },
          "critic_count": {
            "type": "integer",
            "description": "Number of parallel critic agents. 1 = single critic, 3 = multi-critic voting. Default: 1.",
            "enum": [
              1,
              3
            ]
          },
          "completion_notes": {
            "type": "array",
            "items": {
              "type": "string"
            },
            "description": "AI-generated summary of key changes from this feature session. Used to provide rich dependency context to downstream features. Each item is a concise statement about what was built/changed (e.g. APIs added, models created, key file paths)."
          },
          "user_context": {
            "type": "array",
            "items": { "type": "string" },
            "description": "User-provided supplementary materials, preserved verbatim. Each entry is either inline content/rules (stored as-is) or a file reference (e.g. 'src/auth/login.ts:42-78', 'src/utils/ — focus on validation logic')."
          },
          "browser_interaction": {
            "type": "object",
            "description": "Browser verification config for features with UI. Supports playwright-cli and opencli. AI auto-detects dev server command, URL, and port from project config at runtime.",
            "properties": {
              "tool": {
                "type": "string",
                "enum": ["playwright-cli", "opencli", "auto"],
                "default": "auto",
                "description": "Browser tool to use. 'auto' (default) = AI chooses at runtime. 'playwright-cli' = local dev server verification in isolated browser. 'opencli' = reuses Chrome logged-in session, ideal for verifying third-party integrations or OAuth flows."
              },
              "verify_steps": {
                "type": "array",
                "description": "Verification goals describing WHAT to verify (not HOW). AI decides concrete browser tool actions at runtime based on actual code and snapshot. If omitted, AI explores the app and verifies the feature works.",
                "items": {
                  "type": "string"
                }
              }
            }
          }
        }
      }
    },
    "global_context": {
      "type": "object",
      "properties": {
        "tech_stack": {
          "type": "string"
        },
        "language": {
          "type": "string"
        },
        "runtime": {
          "type": "string"
        },
        "frontend_framework": {
          "type": "string"
        },
        "frontend_styling": {
          "type": "string"
        },
        "backend_framework": {
          "type": "string"
        },
        "database": {
          "type": "string"
        },
        "orm": {
          "type": "string"
        },
        "design_system": {
          "type": "string"
        },
        "testing_strategy": {
          "type": "string"
        },
        "bundler": {
          "type": "string"
        },
        "project_type": {
          "type": "string"
        }
      }
    }
  }
}
